ALPHA,Park Name,State,Region,Welcome Letter,CFP Park,Date Cert.,Acreage,Visitation,,
THRB,Theodore Roosevelt Birthplace National Historic Site,NY,NER,,0,," 	22,366 "," 	711,529 ",,
THRI,Theodore Roosevelt Inaugural National Historic Site,NY,NER,,0,," 	36,347 "," 	35,011 ",,
REDW,Redwood National Park,CA,PWR,,1,3/23/11, 	30 ," 	187,041 ",,
THRO,Theodore Roosevelt National Park,ND,MWR,,0,," 	64,701 "," 	41,134 ",,
ROLA,Ross Lake National Recreation Area,WA,PWR,,1,2009," 	1,508,536 "," 	619,971 ",,
THST,Thomas Stone National Historic Site,MD,NER,,0,, 	138 ," 	163,541 ",,
TICA,Timpanogos Cave National Monument,UT,IMR,,0,," 	1,006 "," 	169,608 ",,
TIMU,Timucuan Ecological and Historic Preserve,FL,SER,,0,, 	284 ," 	258,695 ",,
TONT,Tonto National Monument,AZ,IMR,,0,, 	300 ," 	771,461 ",,
TUMA,Tumacacori Naitonal Historic Park,AZ,IMR,,0,," 	5,623 "," 	263,352 ",,
TUPE,Tupelo National Battlefield,MS,SER,,0,, 	513 ," 	261,489 ",,
TUAI,Tuskegee Airmen National Historic Site,AL,SER,,0,, 	235 ," 	647,732 ",,
TUIN,Tuskegee Institute National Historic Site,AL,SER,,0,," 	522,051 "," 	6,955,608 ",,
TUZI,Tuzigoot National Monument,AZ,IMR,,0,, 	230 ," 	430,072 ",,
ULSG,Ulysses S. Grant National Historic Site,MO,MWR,,0,," 	137,991 "," 	2,035,486 ",,
UPDE,Upper Delaware Scenic & Recreational River,NY,NER,,0,," 	2,040 "," 	55,974 ",,
VAFO,Valley Forge National Historic Park,PA,NER,,0,," 	20,001 "," 	188,996 ",,
VAMA,Vanderbilt Mansion National Historic Site,NY,NER,,0,, 	72 ," 	66,682 ",,
VICK,Vicksburg National Military Park,MS,SER,,0,," 	2,853 "," 	1,038,238 ",,
SAFR,San Francisco Maritime National Historic Park,CA,PWR,,1,8/11/10," 	3,945 "," 	193,776 ",,
VICR,Virgin Islands Coral Reef,VI,SER,,0,," 	13,633 "," 	163,576 ",,
VIIS,Virgin Islands National Park,VI,SER,,0,," 	52,830 "," 	463,336 ",,
VOYA,Voyageurs National Park,MN,MWR,,0,, 	39 ," 	686,250 ",,
SAJH,San Juan Island National Historic Park,WA,PWR,,1,1/24/11, 	88 ," 	33,607 ",,
WAPA,War in the Pacific National Historic Park,HI,PWR,,0,, 	108 , 	-00 ,,
WABA,Washita Battlefield National Historic Site,OK,IMR,,0,," 	10,995 "," 	4,249,101 ",,
WEFA,Weir Farms National Historic Site,CT,NER,,0,, 	5 ," 	24,357 ",,
SAMO,Santa Monica Mountains National Recreation Area,CA,PWR,,1,7/26/10," 	1,022 "," 	26,361 ",,
WHHO,White House,DC,NCR,,0,," 	5,073 "," 	147,572 ",,
WHSA,White Sands National Monument,NM,IMR,,0,, 	702 ," 	113,162 ",,
SEKI,Sequoia and Kings Canyon National Park,CA,PWR,,1,2007, 	911 , 	-00 ,,
WIHO,William H Taft National Historic Site,OH,MWR,,0,, 	310 ," 	36,846 ",,
WICR,Wilsons Creek National Battlefield,MO,MWR,,0,, 	982 , 	-00 ,,
WICA,Wind Cave National Park,SD,MWR,,0,,,,,
WHIS,Whiskeytown National Recreation Area,CA,PWR,,1,1/24/11," 	6,181 "," 	265,047 ",,
WORI,Women's Rights National Historic Park,NY,NER,,0,, 	709 ," 	158,882 ",,
WHMI,Whitman Mission National Historic Site,WA,PWR,,1,8/11/10," 	46,295 "," 	842,336 ",,
WRST,Wrangell Saint Elias National Preserve and Preserve,AK,AKR,,0,, 	1 , 	-00 ,,
WRBR,Wright Brothers National Memorial,NC,SER,,,, 	90 ," 	8,962 ",,
VALR,World War II Valor in the Pacific National Monument,HI,PWR,,1,1/12/11, 	58 ," 	61,402 ",,
YOSE,Yosemite National Park,CA,PWR,,1,2006," 	1,795 "," 	533,462 ",,
EVER,Everglades National Park,FL,SER,,1,Jun-05," 	13,893 ", 	-00 ,,
YUHO,Yucca House National Monument,CO,IMR,,0,," 	14,686 "," 	482,033 ",,
YUCH,Yukon Charley Rivers National Preserve,AK,AKR,,0,, 	428 ," 	406,303 ",,
GRSM,Great Smoky Mountains National Park,TN,SER,10/19/11,1,Oct-11,,,,
,TOTALS,,,,110,,,,,